{
  "$schema": "../schemas/doctrines.schema.json",
  "id": "air",
  "name": "Air Doctrine",
  "tracks": [
    {
      "id": "fighter_aircraft",
      "name": "Fighter Aircraft"
    },
    {
      "id": "strike_aircraft",
      "name": "Strike Aircraft"
    },
    {
      "id": "medium_aircraft",
      "name": "Medium Aircraft"
    },
    {
      "id": "heavy_aircraft",
      "name": "Heavy Aircraft"
    }
  ],
  "grandDoctrines": [
    {
      "id": "new_strategic_destruction",
      "name": "Strategic Destruction",
      "tracks": [
        "fighter_aircraft",
        "strike_aircraft",
        "medium_aircraft",
        "heavy_aircraft"
      ],
      "effects": {
        "countryModifiers": {
          "air_escort_efficiency": 0.1,
          "air_strategic_bomber_bombing_factor": 0.1
        }
      },
      "milestones": {
        "fighter_aircraft": {
          "countryModifiers": {
            "air_intercept_efficiency": 0.05
          },
          "unitBonuses": {
            "category_fighter": {
              "air_agility": 0.05
            }
          },
          "scripted": [
            "effect"
          ]
        },
        "strike_aircraft": {
          "countryModifiers": {
            "army_bonus_air_superiority_factor": 0.05,
            "air_nav_efficiency": 0.05
          },
          "scripted": [
            "effect"
          ]
        },
        "medium_aircraft": {
          "countryModifiers": {
            "air_strategic_bomber_defence_factor": 0.1
          },
          "unitBonuses": {
            "category_heavy_fighter": {
              "air_agility": 0.05
            }
          },
          "scripted": [
            "effect"
          ]
        },
        "heavy_aircraft": {
          "countryModifiers": {
            "air_strategic_bomber_bombing_factor": 0.05,
            "air_mission_xp_gain_factor": 0.05
          },
          "scripted": [
            "effect"
          ]
        }
      }
    },
    {
      "id": "new_battlefield_support",
      "name": "Battlefield Support",
      "tracks": [
        "fighter_aircraft",
        "strike_aircraft",
        "medium_aircraft",
        "heavy_aircraft"
      ],
      "effects": {
        "countryModifiers": {
          "air_superiority_detect_factor": 0.075,
          "air_cas_efficiency": 0.05
        }
      },
      "milestones": {
        "fighter_aircraft": {
          "countryModifiers": {
            "air_ace_generation_chance_factor": 0.075,
            "army_bonus_air_superiority_factor": 0.075
          },
          "scripted": [
            "effect"
          ]
        },
        "strike_aircraft": {
          "countryModifiers": {
            "air_cas_present_factor": 0.1
          },
          "unitBonuses": {
            "category_cas": {
              "air_agility": 0.1
            }
          },
          "scripted": [
            "effect"
          ]
        },
        "medium_aircraft": {
          "countryModifiers": {
            "air_mission_xp_gain_factor": 0.05
          },
          "unitBonuses": {
            "tac_bomber": {
              "air_bombing": 0.05
            }
          },
          "scripted": [
            "effect"
          ]
        },
        "heavy_aircraft": {
          "countryModifiers": {
            "air_strategic_bomber_bombing_factor": 0.075,
            "air_interception_detect_factor": 0.05
          },
          "scripted": [
            "effect"
          ]
        }
      }
    },
    {
      "id": "new_operational_integrity",
      "name": "Operational Integrity",
      "tracks": [
        "fighter_aircraft",
        "strike_aircraft",
        "medium_aircraft",
        "heavy_aircraft"
      ],
      "effects": {
        "countryModifiers": {
          "air_interception_detect_factor": 0.1,
          "air_superiority_efficiency": 0.025
        }
      },
      "milestones": {
        "fighter_aircraft": {
          "countryModifiers": {
            "air_mission_xp_gain_factor": 0.075
          },
          "unitBonuses": {
            "category_fighter": {
              "air_agility": 0.075
            }
          },
          "scripted": [
            "effect"
          ]
        },
        "strike_aircraft": {
          "countryModifiers": {
            "air_ace_generation_chance_factor": 0.05,
            "army_bonus_air_superiority_factor": 0.05
          },
          "scripted": [
            "effect"
          ]
        },
        "medium_aircraft": {
          "unitBonuses": {
            "category_tac_bomber": {
              "air_bombing": 0.1
            },
            "category_heavy_fighter": {
              "air_agility": 0.075
            }
          },
          "scripted": [
            "effect"
          ]
        },
        "heavy_aircraft": {
          "countryModifiers": {
            "air_strategic_bomber_defence_factor": 0.075,
            "strategic_bomb_visibility": -0.2
          },
          "scripted": [
            "effect"
          ]
        }
      }
    }
  ],
  "subdoctrines": [
    {
      "id": "air_subdoctrine_fighter_homeland_defense",
      "name": "Homeland Air Defense",
      "tracks": [
        "fighter_aircraft"
      ],
      "effects": {
        "countryModifiers": {
          "air_home_defence_factor": 0.1
        }
      },
      "rewards": [
        {
          "id": "interception_priority",
          "name": "Big Wing Tactics",
          "effects": {
            "countryModifiers": {
              "air_intercept_efficiency": 0.1
            }
          }
        },
        {
          "id": "air_defense_grids",
          "name": "Air Early Warning System",
          "effects": {
            "countryModifiers": {
              "air_interception_detect_factor": 0.1
            }
          }
        },
        {
          "id": "air_wing_knowledge_transfer",
          "name": "Pilot Mentorship",
          "effects": {
            "countryModifiers": {
              "air_untrained_pilots_penalty_factor": -0.075
            }
          }
        },
        {
          "id": "experienced_pilots_protection",
          "name": "Kill Board Competition",
          "effects": {
            "countryModifiers": {
              "air_ace_generation_chance_factor": 0.05
            }
          }
        },
        {
          "id": "mass_sorties",
          "name": "Efficient Ground Crews",
          "effects": {
            "countryModifiers": {
              "air_mission_efficiency": 0.05
            }
          }
        }
      ]
    },
    {
      "id": "air_subdoctrine_escort_fighter",
      "name": "Medium-Range Escort",
      "tracks": [
        "fighter_aircraft"
      ],
      "effects": {
        "unitBonuses": {
          "category_fighter": {
            "air_range": 0.075
          }
        }
      },
      "rewards": [
        {
          "id": "escort_procedures",
          "name": "Top Cover",
          "effects": {
            "countryModifiers": {
              "air_escort_efficiency": 0.05
            }
          }
        },
        {
          "id": "extended_search_patterns",
          "name": "Offensive Fighter Sweep",
          "effects": {
            "countryModifiers": {
              "air_superiority_efficiency": 0.03
            }
          }
        },
        {
          "id": "improved_maintenance_protocols",
          "name": "Regular Engine Overhauls",
          "effects": {
            "countryModifiers": {
              "air_accidents_factor": -0.1
            }
          }
        },
        {
          "id": "increased_sky_presence",
          "name": "Enemy Airfield Suppression",
          "effects": {
            "countryModifiers": {
              "air_power_projection_factor": 0.05
            }
          }
        },
        {
          "id": "constant_air_offensive",
          "name": "Continuous Air Offensive",
          "effects": {
            "countryModifiers": {
              "air_weather_penalty": -0.05,
              "air_night_penalty": -0.05
            }
          }
        }
      ]
    },
    {
      "id": "air_subdoctrine_fighter_bombers",
      "name": "Fighter-Bombers",
      "tracks": [
        "fighter_aircraft"
      ],
      "effects": {
        "unitBonuses": {
          "category_cas": {
            "air_attack": 0.2
          }
        }
      },
      "rewards": [
        {
          "id": "target_prioritization",
          "name": "Air-Ground Comms Channels",
          "effects": {
            "countryModifiers": {
              "air_cas_efficiency": 0.05
            }
          }
        },
        {
          "id": "strafing_runs",
          "name": "Battlefield Loitering",
          "effects": {
            "countryModifiers": {
              "air_cas_present_factor": 0.05
            }
          }
        },
        {
          "id": "versatile_experience",
          "name": "Extensive Debriefing",
          "effects": {
            "countryModifiers": {
              "air_mission_xp_gain_factor": 0.05
            }
          }
        },
        {
          "id": "multi_mission_assignment",
          "name": "Multi-role Capability",
          "effects": {
            "countryModifiers": {
              "air_mission_efficiency": 0.05
            }
          }
        },
        {
          "id": "night_target_search",
          "name": "Night Flying Experience",
          "effects": {
            "countryModifiers": {
              "air_night_penalty": -0.05
            }
          }
        }
      ]
    },
    {
      "id": "air_subdoctrine_tactical_flexibility",
      "name": "Airspace Dominance",
      "tracks": [
        "fighter_aircraft"
      ],
      "effects": {
        "countryModifiers": {
          "air_superiority_efficiency": 0.03
        }
      },
      "rewards": [
        {
          "id": "loose_formation",
          "name": "Loose Formations",
          "effects": {
            "unitBonuses": {
              "category_fighter": {